,user_mentions,tweet_ids,tweets text,created_at,like_count,retweet_count,userid,toenglish,sentiment
0,the_hindu,1785039204625391791,RT @the_hindu: #ElectionsWithTheHindu | The gazette notification for the sixth phase of the #LokSabha elections 2024 is to be issued today.…,2024-04-29 20:11:25+00:00,0,7,1677368584392282115,RT @the_hindu: #ElectionsWithTheHindu | The gazette notification for the sixth phase of the #LokSabha elections 2024 is to be issued today.…,Neutral
1,,1785021235987992825,ఎన్ఆర్ఐ ఓటర్లకు ట్రావెల్ ఏజెంట్ల ఆఫర్.. ఫ్లైట్ బుకింగ్స్‌పై 50 శాతం డిస్కౌంట్ https://t.co/bRn3owBPFG #TeluguIeltsCenters #LokSabha #Nri #Punjabitravel #Travel,2024-04-29 19:00:01+00:00,19,6,1425799761458728962,Travel agents offer to NRI voters.. 50 percent discount on flight bookings https://t.co/bRn3owBPFG #TeluguIeltsCenters #LokSabha #Nri #Punjabitravel #Travel,Positive
2,IndiaTodayHINDI,1784919071055810975,"RT @IndiaTodayHINDI: बोधगया की जिस नदी में आना था गंगाजल, वहां गन्दा नाला कैसे बहने लगा?
दिलचस्प है कि, इसी गया #LokSabha सीट के #NDA उम्मी…",2024-04-29 12:14:03+00:00,0,6,1547587856260300806,"RT @IndiaTodayHINDI: How did the dirty drain start flowing in the river of Bodhgaya where Ganga water was supposed to come?
Interestingly, this is where the #NDA hopeful for the #LokSabha seat…",Negative
